title,href,body
DHL Supply Chain,https://grokipedia.com/page/DHL_Supply_Chain,"DHL Supply Chain logo DHL Supply Chain is the contract logistics division of DHL Group, the world's largest logistics company, specializing in end-to-end supply chain management..."
Supply Chain DHL Careers - Talentreef,https://www.staywithdhl.com/connect-us,"DHL SUPPLY CHAIN IS A WORLD-CLASS COMPANY, AND WE VALUE WORLD-CLASS PEOPLE. At DHL Supply Chain, there are opportunities to grow your career every day. You've already proven that you're an active contributor with a can-do attitude, who's passionate about doing things the right way the first time and being an essential part of everyday life."
My Supply Chain - DHL,https://www.dhl.com/de-en/home/supply-chain/mysupplychain.html,"MySupplyChain is the DHL Supply Chain portal for order tracking, operational reporting, document storage, insights and more."
DHL Home - Global Logistics and International Shipping United ...,https://www.dhl.com/,Our Supply Chain division creates custom solutions for enterprise-sized organizations. Discover what makes DHL Supply Chain the perfect fit as your ...
Why the next five years may make or break your supply chain,https://www.fastcompany.com/91537866/why-the-next-five-years-may-make-or-break-your-supply-chain,"18 May 2026 · DHL Supply Chain helps bridge that gap directly, advising customers on deployment strategy and helping fund the investments themselves. Torres ..."
DHL - YouTube,https://www.youtube.com/channel/UCfsBLXEWNtr26TM2LLpKbGQ,DHL is the leading global brand in the logistics industry.DHL Supply Chain.
DHL | LinkedIn,https://www.linkedin.com/company/dhl,"DHL. Transportation, Logistics, Supply Chain and Storage. See jobs Follow. View all 231,820 employees."
DHL Package Tracking | DHL Tracking International - TrackingMore,https://www.trackingmore.com/dhl-tracking,"3. DHL Supply Chain. DHL Supply Chain is a logistics partner with a robust 15M square feet of storage spread across 1,500+ warehouses in more than 50 countries globally."
DHL Supply Chain Breaks Ground on European... - AmCham Bulgaria,https://amcham.bg/2026/05/27/dhl-supply-chain-breaks-ground-on-european-battery-logistics-hub-in-the-netherlands/,"Holtum (Netherlands), 21. May 2026: DHL Supply Chain, DHL Group’s specialized contract logistics division, has broken ground on a new European Battery Logistics Hub in Holtum, Limburg..."
DHL Supply Chain APAC API - AfterShip,https://www.aftership.com/carriers/dhl-supplychain-apac/api,DHL Supply Chain APAC. Delivery dateMarch10Your order is. is about to pick up.DHL Supply Chain APAC Address Validation (Beta) API.
What Is DHL’s Supply Chain? (All You Need to Know),https://querysprout.com/what-is-dhls-supply-chain/,"DHL Supply Chain offers a number of supply chain solutions. These are broken down into 5 categories: transport solutions, warehousing solutions, management services..."
DHL inaugurates its biggest logistics facility in PH - PortCalls Asia,https://portcalls.com/dhl-inaugurates-its-biggest-logistics-facility-in-ph/,"Rosa Logistics Center covers 50,000-square meters and is part of DHL Supply Chain Southeast Asia Cluster’s €80M investment plan in the Philippines until 2025."
Supply Chain - DHL Group,https://group.dhl.com/de/ueber-uns/unternehmensbereiche/supply-chain.html,"Kerngeschäft unseres Unternehmensbereichs SUPPLY CHAIN sind maßgeschneiderte Logistikdienstleistungen und Lieferketten-Lösungen, um die Komplexität für unsere Kunden zu reduzieren und einen nachhaltigen Mehrwert zu schaffen."
DHL Supply Chain Management GmbH | connecticum,https://www.connecticum.de/arbeitgeber/dhl-supply-chain-management-gmbh-191682,"As the world’s leading contract logistics provider, DHL creates a competitive advantage for its customers in the supply chain business by delivering customised logistics solutions based on globally standardised modular components including warehousing, transportation and value-added services."
Explore DHL Supply Chain Careers | DHL Group,https://careers.dhl.com/global/en/supplychain,"April 14, 2026 - Bringing together warehousing and transportation with a whole host of value-added services, at DHL Supply Chain, we create joined-up logistics solutions that make life easy for our big-name corporate customers."
Jobs und Karriere bei DHL Supply Chain – DHL Supply Chain - Deutschland,https://www.dhl.com/de-de/home/supply-chain/ueber-dhl-supply-chain/teammitglied-werden.html,"DHL Supply Chain bietet Mitarbeitern viele Möglichkeiten, in Supply-Chain-Managementpositionen weltweit aufzusteigen. Published June 12, 2025"
DHL Supply Chain setzt mit seinem europäischen Fulfillment-Netzwerk neuen Branchenstandard im E-Commerce - postbranche.de - postbranche.de,https://www.postbranche.de/2021/02/02/dhl-supply-chain-setzt-mit-seinem-europaeischen-fulfillment-netzwerk-neuen-branchenstandard-im-e-commerce/,"February 2, 2021 - Hier bietet DHL Supply Chain, führender Anbieter in der Kontraktlogistik und Teil von Deutsche Post DHL Group, den Online-Händlern Zugriff auf ein europaweites Netzwerk aus 30 DHL-eigenen e-Fulfillment-Zentren."
DHL Supply Chain : Erweitert die Logistikpartnerschaft mit Iglo,https://www.packreport.de/unternehmen/news/DHL-Supply-Chain-Erweitert-die-Logistikpartnerschaft-mit-Iglo-22803,"August 18, 2022 - DHL Supply Chain, der auf Kontraktlogistik spezialisierte Geschäftsbereich der Deutsche Post DHL Group, wird mit Beginn des kommenden"
DHL Supply Chain - Der Experte für Kontraktlogistik,https://www.packlink.com/de-DE/versandunternehmen/dhl-supply-chain/,"DHL Supply Chain ist ein führender globaler Logistikanbieter. Mit über 40 Jahren Erfahrung in der Branche sind sie darauf spezialisiert, End-to-End-Supply-Chain-Lösungen für Kunden aus verschiedenen Branchen bereitzustellen."
KI treibt Logistik neu: Der nächste KI-Boom trifft Lagerhallen – DHL greift massiv an | wallstreetONLINE - 19.03.2026,https://www.wallstreet-online.de/nachricht/20634248-ki-treibt-logistik-neu-ki-boom-trifft-lagerhallen-dhl-greift-massiv,"March 19, 2026 - Der Boom rund um künstliche Intelligenz treibt die Logistikbranche in eine neue Wachstumsphase. DHL Supply Chain kündigt laut dem Wall Street Journal an an, zehn neue Lagerhäuser in Nordamerika zu eröffnen."
DHL Supply Chain – The world’s leading contract logistics,https://www.dhl.com/gb-en/home/supply-chain.html,Discover what makes DHL Supply Chain the ... DHL Supply Chain has been named a Leader in the 2026 Gartner® Magic Quadrant™ for the 11th year.
DHL Supply Chain – The world's leading contract logistics,https://www.dhl.com/sg-en/home/supply-chain.html,Discover what makes DHL Supply Chain the perfect fit as your outsourced logistics provider (3PL). ... Learn about DHL Supply Chain leadership team ...
DHL Supply Chain – The world's leading contract logistics,https://www.dhl.com/be-en/home/supply-chain.html,Discover what makes DHL Supply Chain the perfect fit as your outsourced logistics provider (3PL). ... Learn about DHL Supply Chain leadership team ...
DHL Home - Global Logistics and International Shipping United,https://www.dhl.com/gb-en/home.html,Discover what makes DHL Supply Chain the perfect fit as your ... Find out how DHL Supply Chain can revolutionise your business as a 3PL provider.
DHL Supply Chain: Transforming Reverse Logistics with ReTurn |,https://supplychaindigital.com/news/dhl-supply-chain-reverse-logistics,"... costs while optimising the handling and disposition of returned goods,"" adds Thomas Borders, Vice President of Operations for DHL Supply Chain North ..."
Logistics Focus: DHL Supply Chain | Supply Chain Magazine,https://supplychaindigital.com/logistics/logistics-focus-dhl-supply-chain,"DHL Supply Chain, founded in 1969 by Adrian Dalsey, Larry Hillblom and Robert Lynn, is a leading logistics company that provides innovative solutions ..."
Dhl International Supply Chain On Exp data And Contact-Great,https://en.52wmb.com/supplier/1250497,... dhl international supply chain ... The trade data displayed on dhl international supply chain on is sourced from the 52wmb.com global trade database.
"May 06, 2025: DHL Supply Chain strengthens its offering to",https://group.dhl.com/en/media-relations/press-releases/2025/dhl-supply-chain-acquires-ids-fulfillment.html,"This marks the second e-commerce acquisition for DHL Supply Chain in 2025, having acquired Inmar's reverse logistics business in January, making it ..."
DHL Supply Chain – der weltweit führende Kontraktlogistikdienstleister Deutschland,https://www.dhl.com/de-de/home/supply-chain.html,"Erfahren Sie, wie Sie den Wert Ihrer Lieferkette mit einem zuverlässigen Logistikpartner maximieren können, dessen herausragender Support weltweit verfügbar ist."
Neue Flächen für DHL Supply Chain,https://logistik-heute.de/fachmagazin/fachartikel/projekte-news-dienstleistung-neue-flaechen-fuer-dhl-supply-chain-259641.html,"April 17, 2026 - Hier finden Sie die aktuellen Ausgaben, die Charakteristik, Redaktion und weitere Informationen zum Fachmagazin"
Logistik,https://www.dhl.de/de/geschaeftskunden/logistik.html,"Transport, Lagerhaltung und Distribution, Supply-Chain-Lösungen - wir bieten alles. Deshalb sind wir der weltgrößte Logistikspezialist."
XING - Dein berufliches Netzwerk,https://www.xing.com/jobs/t-dhl-supply-chain,100 Dhl Supply Chain jobs on the XING jobs network. Find just the right job for you.
,"/clev?event=StartpageResultClick&sc=1tzfoDyGcGZzbMZ2kkMmddGm78slEbFv0B2oCDZMTYS1uwJ1atwvKOjSM2z2l3AYOtc0lSesAd7fAxbv&payload={""bdsSessionId"":""c4e23a961771484aadd24e2d6b581587"",""cheqId"":"""",""countryCode"":""DE"",""deviceType"":""mobile"",""endpoint"":""search.serp"",""hasGoogleAds"":false,""page_id"":""18gD5L77zGLHjhixy"",""queryCategory"":""web"",""segment"":""startpage.udog"",""session_id"":""58mj2gyumcp1h2JI"",""surface"":""serp-web"",""transport"":""href-request""}",
Logistics Automation Using Robotics - Delivered - Global - DHL,https://www.dhl.com/global-en/delivered/innovation/logistics-automation.html,"DHL Global Forwarding, Freight has integrated robotic process automation to automate (and even eliminate) time-consuming tasks and free up people for more value-adding tasks and improved customer service."
Meet the robots that keep DHL running - Automated Warehouse,https://www.automatedwarehouseonline.com/meet-robots-that-keep-dhl-running/,"Generally, DHL prefers robotic systems that can work in many facilities on many different tasks. The first thing the company looks for when evaluating a new automation system is whether it can fit into multiple facilities, according to Sally Miller, DHL Supply Chain’s chief information officer for North America."
Warehouse Robotics and Automation - Delivered - Global,https://www.dhl.com/global-en/delivered/innovation/warehouse-robotics-and-automation.html,"December 13, 2022 - The distribution centers of the future will be made up of an effective internet of things (IoT) network that includes both mobile and stationary robots – automated warehouses operated by intelligent robots, driven by meaningful data, and powered by big data analytics. With a near-zero error rate and per-package sorting speed of 3.6 seconds, the robotic arm has boosted speed and efficiency while streamlining our processes. Scott Ashbaugh, VP of Operations, DHL eCommerce Solutions, Americas"
DHL & AutoStore™ Expand Global Warehouse Automation,https://www.autostoresystem.com/news/dhl-supply-chain-and-autostore-announce-partnership-expansion-to-further-automate-global-warehousing,"Apr 29, 2026 · DHL Supply Chain and AutoStore are enhancing global warehouse automation with over 1,000 robots. Learn more about their partnership expansion. DHL Supply Chain is currently involved in nine AutoStore projects across Singapore, the US and Germany, with four more in planning."
DHL’s AI Robotics Transformation in Warehousing 2025,https://www.linkedin.com/pulse/case-study-dhl-supply-chains-ai-robotics-redefining-odz9f,"Oct 8, 2025 · Facing increasing customer demands for speed, accuracy, and sustainability, DHL sought to modernize its warehouse ecosystem by integrating AI-powered robotics, real-time orchestration systems,..."
"How 8,000 robots are changing work inside logistics giant DHL ... - Fortune",https://fortune.com/2026/05/20/dhl-supply-chainrobotics-workers-cio/,"Sally Miller, the global chief information officer at DHL Supply Chain, has deployed more than 8,000 robotics systems across the logistics provider’s global sites, an investment in automation ..."
DHL integrates HappyRobot AI agents to streamline logistics ...,https://roboticsandautomationnews.com/2025/11/25/dhl-boosts-operational-efficiency-and-customer-communications-with-happyrobots-ai-agents/96928/,"DHL Supply Chain is partnering with HappyRobot to roll out autonomous AI agents that handle high-volume communication, streamline scheduling, improve warehouse coordination, and enhance customer service. The initiative is part of DHL’s broader AI strategy to boost efficiency and employee experience across global logistics operations."
How DHL's Warehouse Robotics Transformed Its Warehousing and Fulfilment -,https://supplychainnuggets.com/how-dhls-warehouse-robotics-transformed-its-warehousing-and-fulfilment/,"DHL utilized a Robotics-as-a-Service (RaaS) model, enabling it to scale quickly without incurring massive upfront costs. Lessons include targeting the right warehouse functions, designing robots to support people, and preparing for scalable automation."
DHL Supply Chain Accelerates Automation Deployments With SVT Robotics Softbot® Platform - DHL - United States of America,https://www.dhl.com/us-en/home/press/press-archive/2026/dhl-supply-chain-accelerates-automation-deployments-with-svt-robotics-softbot-platform.html,"March 16, 2026 - Tech-agnostic platform future-proofs automation deployments with pre-built connectors for new robotics technologies, accelerating automation at scale across its global network · DHL Supply Chain, one of the world’s leading contract logistics providers, announced the deployment of SVT Robotics’ SOFTBOT® platform across its global warehouse network."
DHL integrations | Workflow automation with n8n,https://n8n.io/integrations/dhl/,"Common use cases for DHL automation include automating shipment tracking updates, generating shipping labels directly from your workflows, and managing order fulfillment processes."
"Mar 17, 2026: DHL Supply Chain accelerates automation deployments with SVT Robotics SOFTBOT® platform - DHL Group",https://group.dhl.com/en/media-relations/press-releases/2026/dhl-supply-chain-accelerates-automation-deployments-with-stv-robotics-softbot-platform.html,"March 17, 2026 - Prior to implementing the technology-neutral software, automation projects required separate custom coding for every new technology, taking up to six to eight weeks to initiate new solutions. This made enterprise-wide rollouts and upgrades slow and costly. Supported by the platform's prebuilt SOFTBOT connectors, DHL is redoubling its move away from monolithic, all-in-one systems to modular warehouse setups that accommodate multiple automated solutions and can be reconfigured as technology and customer needs evolve."
"May 13, 2025: DHL Group signs MOU with Boston Dynamics for additional 1,000-robot deployment and accelerates cross-business automation strategy - DHL Group",https://group.dhl.com/en/media-relations/press-releases/2025/dhl-group-signs-mou-with-boston-dynamics-and-accelerates-cross-business-automation-strategy.html,"Looking ahead, DHL plans to expand the range of applications for the robots, including additional use cases such as case picking. ... This agreement marks a significant milestone in an already successful collaboration, which began in 2018 and has since delivered tangible improvements in logistics automation. Published May 9, 2025"
DHL's $737M Robot Army: How AI Transforms Warehouse Labor Economics,https://www.traxtech.com/ai-in-supply-chain/dhls-737m-robot-army-how-ai-transforms-warehouse-labor-economics,"August 18, 2025 - The deployment of 1,000 additional AI-powered robots across DHL's contract logistics operations demonstrates how leading companies are using automation to enhance human capabilities rather than simply replacing workers."
"DHL Global Forwarding, Freight - RPA Success Story - Logistics | UiPath",https://www.uipath.com/resources/automation-case-studies/dhl-global-forwarding-freight,"DHL Global Forwarding, Freight (DGFF) needs to improve its finance and logistics processes across its five Global Service Centers (GSC). Its goal is to create a global process automation hub to remove internal process bottlenecks and position the entire organization to continue to provide top-notch service.Its solution is a classical Human Delivery Center structure complemented by a Virtual Delivery Center enabled by the UiPath Enterprise RPA Platform."
"Nov 11, 2025: DHL boosts operational efficiency and customer communications with HappyRobot’s AI Agents - DHL Group",https://group.dhl.com/en/media-relations/press-releases/2025/dhl-boosts-operational-efficiency-and-customer-communications-with-happyrobots-ai-agents.html,"November 11, 2025 - ""As part of our structured and strategic approach to AI, DHL Supply Chain has been systematically identifying and validating operational use cases for generative and agentic AI technologies for over 18 months. Building on our extensive operational experience with data analytics, robotic process automation, and self-learning software tools, we are now integrating AI agents to drive greater process efficiency for customers while making operational roles more engaging and rewarding for employees by automating repetitive and time-consuming tasks such as manual data entry, routine scheduling, and standardized communications"", Sally Miller, CIO DHL Supply Chain, explained."
DHL Accelerates Automation Deployment with SOFTBOT Platform,https://www.supplychaininforms.com/news/dhl-accelerates-automation-deployment-with-softbot-platform/,"March 18, 2026 - DHL Supply Chain has initiated a major automation deployment across its global warehouse network with the rollout of SVT Robotics’ SOFTBOT® platform. The move builds on an already extensive robotics footprint, with more than 8,000 collaborative robots currently in operation worldwide."
"Jul 09, 2025: DHL to deploy 1,000+ additional robots across UK Operations to support business growth in e-commerce and life sciences health care sector - DHL Group",https://group.dhl.com/en/media-relations/press-releases/2025/dhl-to-deploy-1000-additional-robots-across-uk-operations.html,"Milton Keynes - DHL Supply Chain today announces the investment of £550m (€637m) to expand its infrastructure and accelerate the rollout of automation across its customer operations in UK and Ireland, to support growing demand in the e-commerce and life sciences health care sectors."
DHL Scales Global Operations with Warehouse Automation,https://www.autostoresystem.com/cases/dhl-scales-global-operations-with-autostore,"April 7, 2025 - For more than a decade, DHL Supply Chain has been modernizing their warehouse operations with AutoStore systems, seeking to enable swift scalability and standardized automation across their global markets. Working with AutoStore, the world's leading logistics supplier has grown its automated footprint to 12 operational facilities across 5 countries, with 4 more sites already in development."
DHL supply chain accelerates automation with SOFTBOT platform,https://kloepfel-consulting.com/en/2026/03/26/dhl-supply-chain-automation-softbot/,"March 26, 2026 - According to the press release, DHL Supply Chain is now relying on the SOFTBOT platform from SVT Robotics to accelerate automation projects worldwide. More than 8,000 collaborative robots are already in use at various company locations."
DHL Supply Chain accelerates automation deployments with SVT Robotics SOFTBOT® platform | AJOT.COM,https://www.ajot.com/news/dhl-supply-chain-accelerates-automation-deployments-with-svt-robotics-softbot-platform,"March 17, 2026 - Prior to implementing the technology-neutral software, automation projects required separate custom coding for every new technology, taking up to six to eight weeks to initiate new solutions. This made enterprise-wide rollouts and upgrades slow and costly. Supported by the platform’s prebuilt SOFTBOT connectors, DHL is redoubling its move away from monolithic, all-in-one systems to modular warehouse setups that accommodate multiple automated solutions and can be reconfigured as technology and customer needs evolve."
"DHL Automation at Scale: Partners, Deployments, and Real Numbers",https://www.linkedin.com/pulse/dhl-automation-scale-partners-deployments-real-numbers-stefan-boehmer-hc5nc,"If you automate chaos, you scale chaos—DHL avoids this. Final Thought. Automation at DHL is no longer about pilots—it’s about repeatable execution at global scale."
"Ship with DHL, automate with ShippyPro",https://www.shippypro.com/en/carriers/dhl,"Ship with DHL, automated by ShippyPro. Connect your account and automate label creation, tracking, and returns — all from one dashboard."
Stretch at DHL | Automated Trailer Unloading - YouTube,https://www.youtube.com/watch?v=qgGH6Vk8nY8,DHL Supply Chain is deploying Stretch to automate trailer unloading and support warehouse associates.
DHL Integration | Workflow Automation | Make,https://www.make.com/en/integrations/dhl,"Connect DHL to sync data between apps and create powerful automated workflows. Integrate over 3,000 apps on Make."
DHL Case Study | Automating the full P2P process globally,https://www.basware.com/en/why-basware/customers/dhl/,"DHL Express, a division of DHL, believes that automation and standardisation can improve efficiency.For DHL, the biggest benefit of Basware is automation."
DHL's AI Agent Bet: What Logistics Ops Leaders Should... | Debales AI,https://debales.ai/blog/dhl-ai-agents-logistics-communication-automation,"Ready to see how AI agents handle your appointment scheduling, check calls, and email automation the way DHL does — without the 18-month build timeline?"
DHL Shipping Integration From Shiptheory | Smarter... - Shiptheory,https://shiptheory.com/dhl/,"With shipping label integration and shipping automation at the core of the Shiptheory platform, manual data entry becomes obsolete. Utilise Shiptheory to automatically generate your DHL..."
DHL and HPE: automating administrative and shipping processes |,https://supplychaindigital.com/logistics/dhl-and-hpe-automating-administrative-and-shipping-processes,"Leading logistics company, DHL is no stranger to digital transformation, as it begins its investment into the automation of admin and shipping ..."
DHL Opens Fully-Automated Robotic Fulfillment Center –,https://mailomg.com/2023/01/25/dhl-opens-fully-automated-robotic-fulfillment-center/,"BONN, GERMANY — DHL Supply Chain, the contract logistics specialist of Deutsche Post DHL Group, is now operating a fully-automated robot ..."
DHL automates warehouse operations,https://www.edgesignal.ai/case-studies/dhl-automates-warehouse-operations,"... the power of real-time data processing and analytics for efficient inventory management, predictive maintenance, and more, DHL is able to automate ..."
DHL leans into automation in new Chicago e-commerce facility |,https://www.supplychaindive.com/news/dhl-opens-e-commerce-facility-in-chicago-with-Honeywell-loop-sorter/690834/,"Automation was a key investment area in DHL ... DHL invests $300M to expand, automate US e-commerce network By Max Garland • Sept."
"DHL’s Automation, Robotics, AI Initiatives | Mike Kalil",https://mikekalil.com/tag/dhl/,"DHL Group, the world ’ s largest logistics company, plans to deploy more than 1,000 additional Stretch robots from Boston Dynamics to automate ..."
"DHL Supply Chain facility is showcasing how automation, humans",https://www.scmr.com/article/dhl_supply_chain_facility_is_showcasing_how_automation_humans_can_coexist,"Markus Voss , CIO, said DHL is adopting a philosophy of collaboration between automation and humans as it offers more flexibility and the ability to ..."
DHL and HPE: automating administrative and shipping processes |,https://usscmc.com/dhl-and-hpe-automating-administrative-and-shipping-processes-logistics/,"Leading logistics company, DHL is no stranger to digital transformation, as it begins its investment into the automation of admin and shipping ..."
"Case Study: AWL, Vanderlande and Fizyr Partner to Automate DHL",https://fizyr.com/blog/parcel-induction-automation/,"Case Study: AWL, Vanderlande and Fizyr Partner to Automate DHL Madrid Parcel Induction ... Custom built for DHL Parcel Madrid, this automation ..."
"Case Study: AWL, Vanderlande and Fizyr Partner to Automate DHL",https://www.rockingrobots.com/case-study-awl-vanderlande-and-fizyr-partner-to-automate-dhl-madrid-parcel-induction/,"As labor shortages and increasing parcel volumes challenge logistics operations worldwide, DHL sought to automate a key bottleneck in its sorting ..."
DHL Trade Automation System (TAS),https://www.dhl.de/de/geschaeftskunden/express/infos-knowhow/hilfe-zollabwicklung/dhl-trade-automation-system.html,"KI-gesteuert und gebündelt an einem Ort haben Sie mit MyGTS alle HS-Codes, Gebühren & Steuern, relevante Anforderungen im Zielland und vieles mehr auf einen Blick."
Stationary Robotics - DHL - Germany,https://www.dhl.com/de-en/home/innovation-in-logistics/logistics-trend-radar/robotics-and-automation-logistics.html,The trend of Stationary Robotics encompasses all robots that perform value-adding tasks from a fixed location.
