title,href,body
UNCLASSIFIED (PUBLIC) ROBOTICS & AUTOMATION CASE STUDIES,https://www.dhl.com/content/dam/dhl/global/csi/documents/pdf/glo-csi-supply-chain-accelerated-digitalization-case-studies.pdf,Custom built Automated · Guided Vehicles (AGVs) with laser navigation for · accuracy. • · Inbound and outbound · pallet moves between dock · doors and automated · warehouse conveyors. • · Multiple safety systems for · collaborative working with ·
DHL Accelerates Automation Drive with New Robotics Integration Platform,https://www.ad-hoc-news.de/boerse/news/ueberblick/dhl-accelerates-automation-drive-with-new-robotics-integration-platform/68772353,"March 18, 2026 - In a significant push to enhance ... strategy. The company is deploying a new software platform globally, moving beyond the traditionally slow and complex integration of robotics systems...."
"How package, logistics companies are bringing robots into ...",https://www.cnbc.com/2026/02/13/shipping-auotmation-logistics-labor.html,"Feb 13, 2026 · DHL is one of multiple fulfillment companies moving toward automation and leveraging artificial intelligence as the industry works toward greater efficiency."
Robot Integration Platform: One Layer for Many Robots - Delivered - Global,https://www.dhl.com/global-en/delivered/innovation/so-many-robots-one-simple-integration-layer.html,"April 23, 2026 - Today, our warehouse automation has grown well beyond pilot projects. Across the DHL global network, we now operate thousands of robots from multiple vendors – each with unique software and integration requirements."
Geschäftskundenportal,https://geschaeftskunden.dhl.de/,DHL Geschäftskundenportal invoice automation integration.
,"/clev?event=StartpageResultClick&sc=maXqNizpquQIRacfdmPPovl29IyMvVNRJRpdFZvkZmIBOkiaXzabQ1Du5JYBc4acbloQiTOVIZ7wYt&payload={""bdsSessionId"":""f775e0ab433241efa888045a3a50d168"",""cheqId"":"""",""countryCode"":""DE"",""deviceType"":""mobile"",""endpoint"":""search.serp"",""hasGoogleAds"":false,""page_id"":""1vzeYgzUHgD9QCgra"",""queryCategory"":""web"",""segment"":""startpage.udog"",""session_id"":""ATiVDuxsEWWrn4n3"",""surface"":""serp-web"",""transport"":""href-request""}",
Sustainability - DHL Group,https://group.dhl.com/en/sustainability.html,"Everything we do at DHL Group serves one purpose: Connecting People and Improving Lives. This commitment guides our efforts and sense of responsibility, underscores our values, focuses our mission, and creates long-term value. Fulfilling our purpose requires us to make every dimension of our business sustainable. With our new Sustainability Roadmap, we build on our past achievements and plot a ..."
Sustainability Reporting - DHL Group,https://group.dhl.com/en/sustainability/sustainability-approach/sustainability-reports.html,"In the Sustainability Presentation, we bundle all relevant ESG information and present the programs with the progress made. The Sustainability Statbook includes all published ESG data from 2016 onwards including ESG Disclosure Standards Indexes (GRI, SASB, TCFD and WEF)."
Deutsche Post DHL Group - Sustainability roadmap - Facts ...,https://inmotion.dhl/doc/Coldplay/dpdhl-sustainability-roadmap-facts-figures.pdf,"As a longstanding partner to the United Nations, DPDHL Group supports the UN Sustainable Development Goals (SDGs), focusing on 6 in particular. From programs and philantrophy over responsible business practices to sustainability in Strategy 2025."
"Sustainability at DHL: SAF, EVs & Sustainable Supply Chains",https://sustainabilitymag.com/news/sustainability-at-dhl-saf-evs-sustainable-supply-chains,"Mar 11, 2026 · Working in more than 220 countries can create logistics issues, carbon emissions and environmental influence. To avoid this, DHL Group is reinforcing its commitment to sustainable growth through its Strategy 2030 and 2025 Annual Report: The Next Step."
Milestones from the Green Technology Roadmap | DHL Freight,https://dhl-freight-connections.com/en/business/green-milestones/,"Jul 2, 2025 · In 2017, motivated by its prior achievements, DHL established an ambitious sustainability goal. The company is committed to reducing all logistics-related emissions to net zero by 2050 – a landmark initiative in the logistics industry."
The DHL sustainability overview for customers,https://www.dhl.de/en/privatkunden/information/dhl-nachhaltigkeitsuebersicht.html,What the DHL sustainability overview offers Transparency about the number of your sustainable shipments received with GoGreen or GoGreen Plus that can be assigned to your customer account. Information about the greenhouse gas emission savings through sustainable services from DHL Paket.
SUSTAINABLY BETTER | Deutsche Post DHL,https://www.deutschepost.de/en/n/nachhaltigkeit.html,DHL Group has company-wide environmental protection programs and ambitious goals for emission reduction. The best thing for our climate is to generate as few shipping emissions as possible. That’s why we are investing internally in structural changes to reduce emissions.
Sustainable parcel shipping - joining forces for the good of the ... - DHL,https://www.dhl.de/en/geschaeftskunden/paket/rund-um-den-versand/dhl-nachhaltigkeit-gk.html,"Sustainable shipping with DHL With the new CO 2 e-Sustainability Report, we provide transparency concerning the carbon emissions generated in your domestic shipments of goods with Deutsche Post and DHL. This enables you to ascertain your company's carbon footprint and produce a company carbon report. 1"
How DHL Freight is Positioned for ISO 14001:2026,https://dhl-freight-connections.com/en/business/iso-14001-2026/,"For customers, transparent CO₂ reporting, clear sustainability targets, and compliant transport solutions are becoming baseline expectations. From your perspective, how well positioned is DHL Freight to meet the requirements of ISO 14001:2026, compared to the broader road freight market? DHL Freight is well positioned."
Sustainability - DHL - United Kingdom,https://www.dhl.com/gb-en/home/sustainability.html,"Discover how our customers are reducing their carbon footprint with DHL logistics. ... As one of the world’s leading logistics companies, we have worked hard to set an example for sustainable businesses – from introducing the industry’s first low GHG emission product to being the first logistics company to commit to net-zero emissions. Published September 23, 2025"
Our sustainability approach - DHL Group,https://group.dhl.com/en/sustainability/sustainability-roadmap.html,"“Strategy 2030: Accelerate ... ""Green Logistics of Choice"" as a fourth bottom line complementing our targets. At DHL Group, sustainability is a journey, not a destination...."
Sustainable with GoGreen | DHL,https://www.dhl.de/en/privatkunden/kampagnenseiten/gogreen.html,"Booking GoGreen Plus means your shipments are sustainable. We actively avoid transport-generated greenhouse gas emissions and invest in additional emission reduction measures in the DHL Group logistics network - by purchasing sustainable fuels and electric delivery vehicles, for example."
Environment - DHL Group,https://group.dhl.com/en/sustainability/environment.html,"Book & claim enables DHL to directly replace fossil fuels with sustainable fuels within the logistic company's network and allocate environmental benefits to paying customers, even when their shipments are not physically transported with the assets using these fuels. Published August 15, 2025"
ESG Reporting - Sustainability,https://group.dhl.com/en/sustainability/sustainability-roadmap/sustainability-reports.html,"Since 2021, we have changed our sustainability reporting: The non-financial statement can now be found in the Management Report (Annual Report) and is complemented by the ESG Presentation and the ESG Statbook."
Nachhaltigkeit - DHL - Deutschland,https://www.dhl.com/de-de/home/sustainability.html,"Als eines der weltweit führenden ... verschrieben hat. 1)Nachhaltigkeits-Entwicklungen der DHL Group werden regelmäßig durch unabhängige namhafte Firmen wie SGS und Lieferantenplattformen bewertet.... Published September 23, 2025"
How DHL is reducing its greenhouse gas emissions. Which emission reduced,https://group.dhl.com/content/dam/deutschepostdhl/en/media-center/responsibility/dhl-group-sustainability-brochure.pdf,1 Facilities GHG emissions Scope 1 and 2 in 2025. | 2 Also includes locations that are only certified according to one ISO. | 3 In accordance with the internal DHL Group
DHL Group's 2024 Sustainability Report,https://reporting-hub.group.dhl.com/ecomaXL/files/DHL-Group_2024-Progress-Report-on-Sustainability.pdf,"Additional costs for sustainable fuels were also kept in check. The share of sustainable ... 1) In accordance with the internal DHL Group framework (based on the World Green Buildings Council's guidance, certified by SGS). Deviations permitted in justified exceptional cases."
Sustainable Product Portfolio - DHL - Germany,https://www.dhl.com/de-en/home/sustainability/sustainable-product-portfolio.html,"DHL Global Forwarding is offering guidance to increase carbon efficiency and reduce CO₂e emissions through optimized supply chain design. Together with the DHL Sustainability Experts explore potential carbon optimization options and identify customer-specific levers with the highest impact on your supply chain, for example modal shifts or consolidation of shipments."
Yellow goes green: Our sustainability goals | DHL Express Japan,https://www.dhl.com/discover/en-jp/about/dhl-stories/yellow-goes-green-sustainability,"1 month ago - As a leader in sustainable logistics, DHL sets emissions targets in line with the Paris Agreement and Science-Based Targets initiative (SBTi). We aim to achieve net-zero logistics by 2050."
Sustainability - DHL - United States of America,https://www.dhl.com/us-en/home/sustainability.html,"Discover how our customers are reducing their carbon footprint with DHL logistics. ... As one of the world’s leading logistics companies, we have worked hard to set an example for sustainable businesses – from introducing the industry’s first low GHG emission product to being the first logistics company to commit to net-zero emissions. Published September 23, 2025"
"Sustainable Logistics: Types, Examples & Tips for You | DHL Global",https://www.dhl.com/discover/en-global/logistics-advice/sustainability-and-green-logistics/sustainability-trends-in-logistics,"September 12, 2025 - DHL’s GoGreen Plus, for example, helps you lower emissions by using Sustainable Aviation Fuel (SAF) – an easy way to tackle climate action through your existing shipping account."
Sustainability - DHL - Germany,https://www.dhl.com/de-en/home/sustainability.html,"Discover how our customers are reducing their carbon footprint with DHL logistics. ... As one of the world’s leading logistics companies, we have worked hard to set an example for sustainable businesses – from introducing the industry’s first low GHG emission product to being the first logistics company to commit to net-zero logistics related GHG emissions. Published September 23, 2025"
Our sustainability approach - DHL Group,https://group.dhl.com/en/sustainability/sustainability-approach.html,"At DHL Group, sustainability is a journey, not a destination. That's why we've set milestones to focus our efforts and measure our progress."
Shaping a Sustainable Future: DHL's Remarkable Shift Towards...,https://www.linkedin.com/pulse/shaping-sustainable-future-dhls-remarkable-shift-khairol-anuar,"DHL, a global leader in logistics and express mail services, recognized this imperative and took it upon itself to catalyze change. 2. DHLs Journey Towards Sustainability."
DHL Sustainability Status | DHL,https://www.dhl.de/en/privatkunden/pakete-empfangen/sendungen-verfolgen/nachhaltigkeitsstatus.html,Dhl sustainability status. This is how environmentally friendly your shipment delivery is.
Sustainability | DHL EXPRESS,https://dhlexpress.lt/en/sustainability/,"Sustainability. As the leading mail and logistics company, we aim to connect people and improve their lives. We believe protecting the environment is an integral part of that."
DHL Sustainability Strategy: Carbon Neutral Logistics and Green...,https://thesustainableinnovation.com/dhl-sustainability/,DHL’s 2024 Annual Report introduced the first CSRD-aligned Sustainability Statement covering all five ESRS Environmental standards and three Social standards...
Reducing carbon emissions | DHL eCommerce,https://www.dhlecommerce.nl/en/sustainability,"Reducing carbon emissions. The climate is changing at a pace that demands action. As an organisation with global reach, DHL wants to make a positive contribution."
Find out more about DHL and Formula 1’s sustainability strategies...,https://inmotion.dhl/en/formula-1/sustainability,"In 2024, DHL significantly advanced its commitment to sustainable transport practices in Formula 1® by doubling its fleet of biofueled trucks, from 18 to 37."
One Million Eco-Friendly Kilometers for Manitou Group | DHL Freight,https://dhl-freight-connections.com/en/sustainability/manitou-group/,DHL Freight and Manitou Group are both pursuing challenging sustainability goals and have teamed up on a joint project to reduce CO2e emissions in road freight.
"Dec 02, 2024: Sustainability remains top priority: DHL Express",https://group.dhl.com/en/media-relations/press-releases/2024/dhl-express-launches-global-sustainability-survey-2024.html,"eBook "" Sustainability Matters: DHL Express' Global Survey on Small Businesses "" offers insights from small and medium-sized companies ..."
"DHL: What drives social, sustainable, and cross-border shoppers",https://www.ajot.com/news/dhl-what-drives-social-sustainable-and-cross-border-shoppers,"DHL: What drives social, sustainable, and cross-border shoppers ... Our latest report highlights that convenience, transparency, and sustainability ..."
Sustainability with the DHL Fulfillment Network - United States,https://www.dhl.com/us-en/microsites/supply-chain/fulfillment-network/why-dhl/sustainability.html,The DHL Fulfillment Network Goes Above and Beyond to Be a Sustainable Partner ... Sustainability: it’s integrated at every level. It guides our ...
DHL focuses on sustainable transportation of pharmaceutical,https://payloadasia.com/2024/10/dhl-sustainable-transportation-pharmaceutical-products-alexion-ireland-europe/,"The use of HVO, one of DHL ’ s sustainable approaches, will reduce annual Greenhouse Gas (GHG) emissions by up to 90 percent compared to diesel ..."
"DHL Commits €7 Billion to Sustainable Supply Chain, Links",https://www.esgtoday.com/dhl-commits-e7-billion-to-sustainable-supply-chain-links-exec-comp-to-esg/,"Logistics giant Deutsche Post DHL announced today the launch of its new Sustainability Roadmap, representing a significant ramp in the company’s ..."
Suntory & DHL: A Sustainable Supply Chain Partnership |,https://fooddigital.com/news/dhl-suntory-partnership-expansion,"... GB&I , producer of soft drinks brands including Lucozade and Ribena, expands its partnership with DHL Supply Chain to enhance the sustainability ..."
DHL Group Hits New Sustainability Milestones in Asia Pacific -,https://logistics-manager.com/dhl-group-hits-new-sustainability-milestones-in-asia-pacific/,"DHL Group has announced a series of major sustainability breakthroughs across the Asia Pacific region, marking a significant acceleration of its net ..."
Fostering climate action - DHL Group,https://group.dhl.com/en/sustainability/social-impact-programs/environmental-protection.html,"As the world's leading logistics company, we've made it our mission to achieve net-zero emissions by 2050. Turning that bold statement into bold action includes motivating our people to participate in climate protection initiatives and encouraging our customers and partners to support more ..."
DHL Sustainability Roadmap - YouTube,https://www.youtube.com/watch?v=FFsf1zMa5UU,We are turning our yellow company into a green one.
,"/clev?event=StartpageResultClick&sc=1tzfoDyGcGZ21Gutsinj3dfYFCOXFEfx6za99msIhQgtVsrW9jGE8iSUku8gdfe3tMalM23gKtMEbAqV&payload={""bdsSessionId"":""6c9f48dddb02452cb26371ffa08f5cbc"",""cheqId"":"""",""countryCode"":""DE"",""deviceType"":""mobile"",""endpoint"":""search.serp"",""hasGoogleAds"":false,""page_id"":""18tvWayDIgL1QtqGy"",""queryCategory"":""web"",""segment"":""startpage.udog"",""session_id"":""PrztsROE3QzjyiyI"",""surface"":""serp-web"",""transport"":""href-request""}",
