Query,Category,Recommendation,Score
DHL warehouse automation opportunities,automation,Accelerate warehouse automation and robotics deployment.,30
DHL renewable energy logistics opportunities,energy,Increase investment in New Energy Logistics.,17
DHL sustainability strategy,sustainability,Expand sustainable logistics initiatives.,26
DHL e commerce fulfillment growth,ecommerce,Expand e-commerce fulfillment capabilities.,14
DHL strategic partnerships,ecommerce,Expand e-commerce fulfillment capabilities.,8
DHL AI analytics machine learning,ai,Invest in AI-powered logistics optimization.,22
