title,source
Top stories,Supply Chain Dive
FedEx fuel surcharge change raises heat on export shipments,Supply Chain Dive
BJ’s Wholesale Club uses tariff refunds to cut prices,Supply Chain Dive
Nestlé ups automation use with latest distribution center,Supply Chain Dive
FedEx inks MOU with China-based airline to boost air cargo network,Supply Chain Dive
"Fed ends bias toward more easing, holds benchmark rate steady",Supply Chain Dive
Trump’s tariffs: Tracking the status of US trade actions,Supply Chain Dive
Your supply chain has a visibility problem. Your executives have a decision problem.,Supply Chain Dive
Burlington opens high-tech distribution center in Georgia,Supply Chain Dive
"FedEx Network 2.0: Tracking closures, layoffs across the US",Supply Chain Dive
Inside Bristol Myers’ AI-powered procurement overhaul,Supply Chain Dive
Trump is shaking up customs rules. What should shippers know?,Supply Chain Dive
EU gives final approval to install US tariff deal,Supply Chain Dive
Walmart plans $8M phase of Texas distribution center remodel,Supply Chain Dive
Why furniture delivery isn’t part of Ollie’s plans,Supply Chain Dive
"DOT to launch supply chain initiative, visibility dashboard",Supply Chain Dive
"Tracking the speed, dwell and cars of Class I railroads",Supply Chain Dive
Boston Scientific to build Indiana distribution center,Supply Chain Dive
"Air freight spot rates spike 41% YoY in May, but relief expected soon",Supply Chain Dive
Grocery Outlet turns to AI to modernize supply chain,Supply Chain Dive
Kimberly-Clark credits supply chain for productivity gains,Supply Chain Dive
Federal court temporarily upholds Trump’s 10% global tariff,Supply Chain Dive
"Ocean shippers frontload cargo ahead of tariffs, fuel concerns",Supply Chain Dive
Kenvue Canada saves big on diesel costs with Fuel Transport EV pilot,Supply Chain Dive
Tariff refunds may soon cover more entries — but not without a fight,Supply Chain Dive
"Dell, HPE server supply upended by memory crunch",Supply Chain Dive
PepsiCo expanding autonomous truck use in its supply chain,Supply Chain Dive
Why Fiji Water temporarily operated its own shipping network,Supply Chain Dive
Burlington bets on ocean contracts to combat elevated freight costs,Supply Chain Dive
"Inflation jumps 4.2%, spurred by war-induced surge in energy prices",Supply Chain Dive
Razor reshapes supply chain to weather Trump-era China tariffs,Supply Chain Dive
Novelis restarts Oswego hot mill months after fires,Supply Chain Dive
Get the free newsletter,Supply Chain Dive
Take yourknowledge further with,Supply Chain Dive
You're all set,Supply Chain Dive
Most Popular,Supply Chain Dive
Library resources,Supply Chain Dive
Company Announcements,Supply Chain Dive
What We're Reading,Supply Chain Dive
Industry Intel,Supply Chain Dive
Supply Chain Dive news delivered to your inbox,Supply Chain Dive
Get Supply Chain Dive in your inbox,Supply Chain Dive
